{
  "$id": "research-brief.v1.schema.json",
  "$schema": "https://json-schema.org/draft/2020-12/schema",
  "additionalProperties": {},
  "properties": {
    "briefedAt": {
      "pattern": "^\\d{4}-\\d{2}-\\d{2}T\\d{2}:\\d{2}:\\d{2}\\.\\d{3}Z$",
      "type": "string"
    },
    "kind": {
      "const": "ResearchBrief",
      "type": "string"
    },
    "mode": {
      "enum": [
        "full",
        "reference-only"
      ],
      "type": "string"
    },
    "queries": {
      "items": {
        "additionalProperties": {},
        "properties": {
          "facet": {
            "enum": [
              "product-category",
              "flow",
              "screen-type",
              "ux-pattern",
              "ui-element",
              "visual-style",
              "density",
              "content-strategy",
              "navigation"
            ],
            "type": "string"
          },
          "id": {
            "pattern": "^Q-[0-9a-f]{8}$",
            "type": "string"
          },
          "job": {
            "maxLength": 200,
            "minLength": 1,
            "type": "string"
          },
          "origin": {
            "enum": [
              "provided",
              "inferred"
            ],
            "type": "string"
          },
          "query": {
            "maxLength": 120,
            "minLength": 1,
            "type": "string"
          },
          "question": {
            "type": [
              "string",
              "null"
            ]
          },
          "rationale": {
            "type": [
              "string",
              "null"
            ]
          }
        },
        "required": [
          "id",
          "facet",
          "job",
          "query",
          "question",
          "rationale",
          "origin"
        ],
        "type": "object"
      },
      "type": "array"
    },
    "run": {
      "additionalProperties": {},
      "properties": {
        "cacheKey": {
          "pattern": "^[0-9a-f]{64}$",
          "type": "string"
        },
        "path": {
          "maxLength": 512,
          "type": "string"
        },
        "provider": {
          "enum": [
            "claude-code",
            "codex-cli",
            "fake"
          ],
          "type": "string"
        },
        "runId": {
          "pattern": "^run-\\d{8}T\\d{6}Z-[0-9a-f]{8}$",
          "type": "string"
        },
        "template": {
          "additionalProperties": {},
          "properties": {
            "id": {
              "minLength": 1,
              "type": "string"
            },
            "sha256": {
              "pattern": "^[0-9a-f]{64}$",
              "type": "string"
            },
            "version": {
              "maximum": 9007199254740991,
              "minimum": 1,
              "type": "integer"
            }
          },
          "required": [
            "id",
            "version",
            "sha256"
          ],
          "type": "object"
        }
      },
      "required": [
        "runId",
        "path",
        "provider",
        "template",
        "cacheKey"
      ],
      "type": "object"
    },
    "schemaVersion": {
      "const": 1,
      "type": "number"
    }
  },
  "required": [
    "kind",
    "schemaVersion",
    "mode",
    "briefedAt",
    "run",
    "queries"
  ],
  "title": "ResearchBrief",
  "type": "object"
}
