{
  "kind": "ResearchBrief",
  "schemaVersion": 1,
  "mode": "reference-only",
  "briefedAt": "2026-10-01T10:00:00.000Z",
  "run": {
    "runId": "run-20261001T100000Z-aaaaaaaa",
    "path": "runs/run-20261001T100000Z-aaaaaaaa.json",
    "provider": "fake",
    "template": {
      "id": "researcher/research-brief",
      "version": 1,
      "sha256": "aaaaaaaaaaaaaaaaaaaaaaaaaaaaaaaaaaaaaaaaaaaaaaaaaaaaaaaaaaaaaaaa"
    },
    "cacheKey": "aaaaaaaaaaaaaaaaaaaaaaaaaaaaaaaaaaaaaaaaaaaaaaaaaaaaaaaaaaaaaaaa"
  },
  "queries": [
    {
      "id": "Q-aaaaaaaa",
      "facet": "visual-style",
      "job": "find calm pricing",
      "query": "<script>alert(\"x\")</script>",
      "question": null,
      "rationale": null,
      "origin": "inferred"
    }
  ]
}
